Название товора,Ссылка,Артикул,Описание,Производитель,Цена,Изображение
"Бюретка, Boroflo, оснащена Boroflo ОН, 25 мл, интервал градуировки 0.1 мл. 25 мл",https://himbio.ru/catalog/steklo_borosil/byuretki/byuretka_boroflo_osnashchena_boroflo_on_25_ml_interval_graduirovki_0_1_ml_25_ml/,2121009A,"– СоответствуютISO / DIN 385
– Калибровка при 20°С
– Как правило, используются в процессе титрования
– Поставляются с Boroflo краном с ПТФЭ шпинделем, который обладает высокой устойчивостью к химическому воздействию
– Индивидуально протестированы, для точного объема, распределенного на 3 пунктах по шкале
– Нет необходимости в смазке, так как используется ПТФЭ шпиндель",БОРОСИЛ ГЛАСС ВОРКС ЛИМИТЕД,"
																									5 250 руб.																											/шт																																				",https://himbio.ru/upload/iblock/f9c/f9c40784b37449dc4590537a5e606765.png
