Название товора,Ссылка,Артикул,Описание,Производитель,Цена,Изображение
"Бюретка, с прямым краном, точность согласно классу B, 5 мл, интервал градуировки 0.02 мл.",https://himbio.ru/catalog/steklo_borosil/byuretki/byuretka_s_pryamym_kranom_tochnost_soglasno_klassu_b_5_ml_interval_graduirovki_0_02_ml/,2124005D,"– СоответствуютISO / DIN 385
– Калибровка при 20°С
– Разработаны с прямым краном, что увеличивает срок службы, по сравнению с кранами с ПТФЭ шпинделями
– Стеклянный кран усиливает контроль и обеспечивает более плавные действия",БОРОСИЛ ГЛАСС ВОРКС ЛИМИТЕД,"
																									3 535 руб.																											/шт																																				",https://himbio.ru/upload/iblock/26b/26b31a28ac81d3fedfcee4f43ec5d799.png
