Название товора,Ссылка,Артикул,Описание,Производитель,Цена,Изображение
"Тигель Гуча, низкий, со спеченным диском, D диска 40 мм, высота 60 мм, 50 мл, класс порист. 1",https://himbio.ru/catalog/steklo_borosil/spechennaya_posuda/tigel_gucha_nizkiy_so_spechennym_diskom_d_diska_40_mm_vysota_60_mm_50_ml_klass_porist_1/,3206012,"– Изготовлен из боросиликатного стекла
– Особенно пригоден для работы по анализу, где осадки осушаются до постоянного веса при 110°С
– Тигель не должен подвергаться резким перепадам температур
– Для того чтобы избежать деформации, их нельзя извлекать из печи, пока температура не упадет до 250 °С
– Тигель Гуча используется для литья металла и анализа",БОРОСИЛ ГЛАСС ВОРКС ЛИМИТЕД,"
																									1 400 руб.																											/шт																																				",https://himbio.ru/upload/iblock/591/591b8211b8a5acb92a95dd00937ddb9d.png
