Название товора,Ссылка,Артикул,Описание,Производитель,Цена,Изображение
"Акватермальный теплообменник, Акватермальный теплообменник, 365 W",https://himbio.ru/catalog/steklo_borosil/distillyatory/akvatermalnyy_teploobmennik_akvatermalnyy_teploobmennik_365_w/,3368000,"Акватермальные теплообменники могут использоваться с дистилляторами. Горячая вода освобождается на выходе холодильника и обычно стекает в раковину, и мы теряем драгоценную
воду. Однако акватермальный теплообменник оборудован охлаждающим змеевиком и вентилятором, что охлаждает горячую воду, когда она выходит, а затем перекачивает ее на вход
холодильника, экономя тем самым воду.
Преимущества: Они могут быть установлены на столе, чтобы занимать меньше места. Потребляемая мощность минимальна. Необходимо только 15 литров воды, чтобы запустить
дистиллятор (одиночный или двухместный).",БОРОСИЛ ГЛАСС ВОРКС ЛИМИТЕД,"
																									348 303 руб.																											/шт																																				",https://himbio.ru/upload/iblock/e4b/e4b8b8bb07ae770ce2394809dc97736f.png
