Название товора,Ссылка,Артикул,Описание,Производитель,Цена,Изображение
"Акватермальный теплообменник, 730W",https://himbio.ru/catalog/steklo_borosil/distillyatory/akvatermalnyy_teploobmennik_730w/,3368001,"Акватермальные теплообменники могут использоваться с дистилляторами. Горячая вода освобождается на выходе холодильника и обычно стекает в раковину, и мы теряем драгоценную
воду. Однако акватермальный теплообменник оборудован охлаждающим змеевиком и вентилятором, что охлаждает горячую воду, когда она выходит, а затем перекачивает ее на вход
холодильника, экономя тем самым воду.
Преимущества: Они могут быть установлены на столе, чтобы занимать меньше места. Потребляемая мощность минимальна. Необходимо только 15 литров воды, чтобы запустить
дистиллятор (одиночный или двухместный).",БОРОСИЛ ГЛАСС ВОРКС ЛИМИТЕД,"
																									921 200 руб.																											/шт																																				",https://himbio.ru/upload/iblock/d8c/d8ce2cf08a62afb107e80bf9e07b957a.png
