Название товора,Ссылка,Артикул,Описание,Производитель,Цена,Изображение
"Воронки Шотта, со спеченным диском,D диска 40 мм, D стержня 8 мм,высота 149 мм,80 мл,класс порист.4",https://himbio.ru/catalog/steklo_borosil/spechennaya_posuda/voronki_shotta_so_spechennym_diskom_d_diska_40_mm_d_sterzhnya_8_mm_vysota_149_mm_80_ml_klass_porist_/,3606872,"– Изготовлены из боросиликатного стекла
– Особенно полезны, когда фильтровальная бумага может быть разъедена фильтрованным материалом
– Обычно используются в качественном неорганическом анализе и препаративной химии
– Устойчивы к коррозии и нагреванию",БОРОСИЛ ГЛАСС ВОРКС ЛИМИТЕД,"
																									2 030 руб.																											/шт																																				",https://himbio.ru/upload/resize_cache/webp/iblock/fd8/fd8c4b3450bfe8e089531d9118352196.webp
