Название товора,Ссылка,Артикул,Описание,Производитель,Цена,Изображение
"Воронки Шотта , со спеченным диском, D диска 30 мм,D стержня 8 мм,высота 137 мм,35 мл,класс порист.5",https://himbio.ru/catalog/steklo_borosil/spechennaya_posuda/voronki_shotta_so_spechennym_diskom_d_diska_30_mm_d_sterzhnya_8_mm_vysota_137_mm_35_ml_klass_porist_/,3606958,"– Изготовлены из боросиликатного стекла
– Особенно полезны, когда фильтровальная бумага может быть разъедена фильтрованным материалом
– Обычно используются в качественном неорганическом анализе и препаративной химии
– Устойчивы к коррозии и нагреванию",БОРОСИЛ ГЛАСС ВОРКС ЛИМИТЕД,"
																									2 730 руб.																											/шт																																				",https://himbio.ru/upload/iblock/db1/db180d0a84a343757979d9ed88b91407.png
