Название товора,Ссылка,Артикул,Описание,Производитель,Цена,Изображение
"Экстрактор Сокслета, с взаимозаменяемыми соединениями,1000мл, колба 3000 мл.",https://himbio.ru/catalog/steklo_borosil/ekstraktory/ekstraktor_soksleta_s_vzaimozamenyaemymi_soedineniyami_1000ml_kolba_3000_ml/,3840029,"– Соответствует IS 10640
– Используется для выделения экстракта из жидкого или твердого вещества
– Большая площадь поверхности, чем у холодильника Либиха из-за ряда шариков
– Этот метод позволяет эффективное разделение, с относительно небольшими количеством растворителя
– Идеально подходит для лабораторного нагревания с обратным холодильником",БОРОСИЛ ГЛАСС ВОРКС ЛИМИТЕД,"
																									57 750 руб.																											/шт																																				",https://himbio.ru/upload/resize_cache/webp/upload/iblock/5c4/5c48cb674ab4622fea322382e61b23b8.webp
