Название товора,Ссылка,Артикул,Описание,Производитель,Цена,Изображение
"Колонка, хроматографич, не маркир, с микропор. диском и  кр. Boroflo, дл.экстр. 450 мм, канал 30мм",https://himbio.ru/catalog/steklo_borosil/kolonki_khromatograficheskie/kolonka_khromatografich_ne_markir_s_mikropor_diskom_i_kr_boroflo_dl_ekstr_450_mm_kanal_30mm/,6111063,"– Оснащены ПТФЭ шпинделем, который обладает высокой устойчивостью к химическому воздействию
– Нет необходимости в смазке, когда используется ПТФЭ шпиндель
– Колонка дополнена микропористым диском для лучшего результата
– Как правило, используются для очистки индивидуальных соединений из смеси соединений",БОРОСИЛ ГЛАСС ВОРКС ЛИМИТЕД,"
																									3 605 руб.																											/шт																																				",https://himbio.ru/upload/iblock/8ce/8cef39ad1c1370f83ca65c1909a55105.png
