Название товора,Ссылка,Артикул,Описание,Производитель,Цена,Изображение
"Колонка хроматограф., не маркир, с микропор. диском, с ПТФЭ краном, дл.экстракт.450 мм, канал 30 мм.",https://himbio.ru/catalog/steklo_borosil/kolonki_khromatograficheskie/kolonka_khromatograf_ne_markir_s_mikropor_diskom_s_ptfe_kranom_dl_ekstrakt_450_mm_kanal_30_mm/,6121063,"– Оснащены ПТФЭ шпинделем, который обладает высокой устойчивостью к химическому воздействию
– Нет необходимости в смазке, когда используется ПТФЭ шпиндель
– Колонка дополнена микропористым диском для лучшего результата
– Как правило, используются для очистки индивидуальных соединений из смеси соединений",БОРОСИЛ ГЛАСС ВОРКС ЛИМИТЕД,"
																									6 440 руб.																											/шт																																				",https://himbio.ru/upload/resize_cache/webp/iblock/fb4/fb462a9ddf980dc9453a2494caa9fbc7.webp
