Название товора,Ссылка,Артикул,Описание,Производитель,Цена,Изображение
"Флакон с резьбой из прозрачного стекла 15х45 мм, 4 мл, 100 шт/уп.",https://himbio.ru/catalog/steklo_borosil/flakony_vialy/flakon-s-rezboy-iz-prozrachnogo-stekla-15kh45-mm-4-ml-100-sht-up/,VO04C11300S000,"ФЛАКОНЫ: 4мл, 15 X 45 мм, Флаконы с винтовой резьбой. Из прозрачного стекла.
Эти 15 х 45 мм флаконы могут вместить до 4 мл проб. Они используются в 48-позиционном
пробоотборнике воды, лотке пробоотборника Agilent (G2880A), который используется с
пробоотборниками Agilent 6850, в 7673 и 7683. Эти флаконы могут быть также использованы в
автоматической системе Perkin-Elmer GC, Shimadzu АОС-14/1400, LC-10A, и SIL-2AS. Они могут
быть использованы в качестве пробирок для проб, для промывки или даже как флаконы для отходов.
С крышками и прокладками 13 х 425 они используют в качестве пробирок для снятия проб. Эти флаконы также можно использовать как флаконы для хранения.",БОРОСИЛ ГЛАСС ВОРКС ЛИМИТЕД,48 650 руб.																											/упак																										,https://himbio.ru/upload/resize_cache/webp/upload/iblock/ae2/ae2e7ea7078e2f017424963cc48a3c85.webp
